{
  "documentType": "yabt.backupRoot",
  "schemaVersion": 1,
  "rootRole": "source",
  "archiveId": "018fc4c7-8ec8-7cf4-b5cb-5e31d5d8d15a",
  "name": "Personal archive",
  "defaultStoreId": "local-archive",
  "changeManifestCompression": "brotli",
  "historyDeduplicationTinyFileMaximumBytes": 4096,
  "createdAtUtc": "2026-05-28T18:30:00Z",
  "layout": {
    "livePrefix": "",
    "histPrefix": ".yabt-hist"
  },
  "stores": [
    {
      "id": "local-archive",
      "kind": "fileSystem",
      "rootPath": "E:\\Archive"
    },
    {
      "id": "main-azure",
      "kind": "azureBlob",
      "configSectionPath": "ObjectStores:MainAzure"
    },
    {
      "id": "pcloud",
      "kind": "webDav",
      "endpoint": "https://webdav.pcloud.com",
      "rootPath": "/YABT",
      "credentialRef": "pcloud-main"
    }
  ]
}
